{
  "schemaVersion": 1,
  "source": "governance.records",
  "qualification": "Canonical structured register facts. Human-readable views are derived from this structured state and the applicable governing procedures; no committed Markdown register is an independent authority.",
  "views": [
    {
      "id": "competence-baseline",
      "columns": [
        {
          "key": "id",
          "label": "ID"
        },
        {
          "key": "roleActivity",
          "label": "Role / activity"
        },
        {
          "key": "requiredCompetence",
          "label": "Required competence"
        },
        {
          "key": "currentEvidence",
          "label": "Current evidence"
        },
        {
          "key": "currentStatus",
          "label": "Current status"
        },
        {
          "key": "requiredNextEvidence",
          "label": "Required next evidence"
        }
      ]
    }
  ],
  "records": [
    {
      "id": "COMP-001",
      "view": "competence-baseline",
      "order": 1,
      "fields": {
        "roleActivity": "Management-System Owner",
        "requiredCompetence": "Scope, policy, risk, objectives, SoA, controlled documented information, management review, corrective action",
        "currentEvidence": "Current consolidated management-system authorities and controlled repository history evidence active implementation of the defined governance model",
        "currentStatus": "Partial",
        "requiredNextEvidence": "Complete the initial competence/self-assessment review and retain rationale for areas requiring specialist or independent support"
      },
      "relationships": []
    },
    {
      "id": "COMP-002",
      "view": "competence-baseline",
      "order": 2,
      "fields": {
        "roleActivity": "Change / Release Owner",
        "requiredCompetence": "`DEMO-###` lifecycle, CI, semantic versioning, tag-only release/deployment, rollback, verification",
        "currentEvidence": "`CHANGE-MANAGEMENT.md`, release workflows/docs, controlled repository history",
        "currentStatus": "Partial",
        "requiredNextEvidence": "Retain periodic release-control review evidence and verify any high-risk change receives proportional specialist/security review"
      },
      "relationships": []
    },
    {
      "id": "COMP-003",
      "view": "competence-baseline",
      "order": 3,
      "fields": {
        "roleActivity": "Operations / Recovery Owner",
        "requiredCompetence": "Cloudflare operation, health/log evidence, admin/offline controls, incident escalation, recovery",
        "currentEvidence": "`OPERATIONS.md`, incident process, backup/recovery procedure, runtime evidence model",
        "currentStatus": "Partial",
        "requiredNextEvidence": "Complete `RT-001` technical restore exercise and retain observed recovery results"
      },
      "relationships": []
    },
    {
      "id": "COMP-004",
      "view": "competence-baseline",
      "order": 4,
      "fields": {
        "roleActivity": "Information Security Owner",
        "requiredCompetence": "Authentication/authorization, secrets, logging, webhook/security boundaries, security risk, incident response",
        "currentEvidence": "`SECURITY.md`, security risk register, incident/corrective-action procedures, security-oriented implementation evidence",
        "currentStatus": "Partial",
        "requiredNextEvidence": "Complete focused security-control review and use specialist input for unfamiliar high-impact threats where needed"
      },
      "relationships": []
    },
    {
      "id": "COMP-005",
      "view": "competence-baseline",
      "order": 5,
      "fields": {
        "roleActivity": "AI Governance / Capability Owner",
        "requiredCompetence": "MCP protocol/tools, intended use, server-side authorization, AI risk/impact, supplier boundary, evaluation, change triggers",
        "currentEvidence": "AI policy, AI risk register, MCP impact assessment, SoA, MCP implementation/evaluation evidence",
        "currentStatus": "Partial",
        "requiredNextEvidence": "Expand AI evaluation coverage and complete first competence/awareness review; reassess before any authority/provider expansion"
      },
      "relationships": []
    },
    {
      "id": "COMP-006",
      "view": "competence-baseline",
      "order": 6,
      "fields": {
        "roleActivity": "Accessibility Verification Owner",
        "requiredCompetence": "WCAG 2.2 criteria relevant to the demo, automated/manual distinction, keyboard/focus/reflow/AT testing",
        "currentEvidence": "`ACCESSIBILITY.md` and accessibility demo/evidence structure",
        "currentStatus": "Partial",
        "requiredNextEvidence": "Retain dated manual verification evidence and obtain specialist/AT review where internal evidence is insufficient"
      },
      "relationships": []
    },
    {
      "id": "COMP-007",
      "view": "competence-baseline",
      "order": 7,
      "fields": {
        "roleActivity": "Supplier Owner",
        "requiredCompetence": "Provider responsibility boundary, permissions, data/AI exposure, continuity, review triggers",
        "currentEvidence": "Supplier-management procedure and initial supplier register",
        "currentStatus": "Partial",
        "requiredNextEvidence": "Complete initial periodic supplier review for GitHub, Cloudflare, Codex, and Claude by the scheduled review date"
      },
      "relationships": []
    },
    {
      "id": "COMP-008",
      "view": "competence-baseline",
      "order": 8,
      "fields": {
        "roleActivity": "Incident / Corrective-Action Owner",
        "requiredCompetence": "Severity, evidence preservation, containment, investigation, communication, corrective action, effectiveness",
        "currentEvidence": "Incident and Clause 10 procedures",
        "currentStatus": "Planned",
        "requiredNextEvidence": "Complete `EX-001` incident exercise and retain lessons/actions"
      },
      "relationships": []
    },
    {
      "id": "COMP-009",
      "view": "competence-baseline",
      "order": 9,
      "fields": {
        "roleActivity": "Internal Auditor / Independent Reviewer",
        "requiredCompetence": "Audit method, sampling, evidence evaluation, findings, impartiality",
        "currentEvidence": "Audit program defines requirements and self-assessment distinction",
        "currentStatus": "Restricted",
        "requiredNextEvidence": "Formal internal-audit claims require a reviewer with sufficient objectivity from the audited work; self-review remains self-assessment"
      },
      "relationships": []
    }
  ]
}
