{
  "schemaVersion": 1,
  "source": "governance.records",
  "qualification": "Canonical structured register facts. Human-readable views are derived from this structured state and the applicable governing procedures; no committed Markdown register is an independent authority.",
  "views": [
    {
      "id": "suppliers",
      "columns": [
        {
          "key": "id",
          "label": "ID"
        },
        {
          "key": "supplierService",
          "label": "Supplier / service"
        },
        {
          "key": "class",
          "label": "Class"
        },
        {
          "key": "role",
          "label": "Role"
        },
        {
          "key": "approvalState",
          "label": "Approval state"
        },
        {
          "key": "owner",
          "label": "Owner"
        },
        {
          "key": "initialReviewState",
          "label": "Initial review state"
        }
      ]
    }
  ],
  "records": [
    {
      "id": "SUP-001",
      "view": "suppliers",
      "order": 1,
      "fields": {
        "supplierService": "GitHub",
        "class": "Critical",
        "role": "Source control, pull requests, Actions, release/evidence history",
        "approvalState": "Approved",
        "owner": "Change / Release owner",
        "initialReviewState": "Baseline documented; recurring supplier review pending"
      },
      "relationships": []
    },
    {
      "id": "SUP-002",
      "view": "suppliers",
      "order": 2,
      "fields": {
        "supplierService": "Cloudflare",
        "class": "Critical",
        "role": "Runtime, edge, DNS/TLS, Workers, D1, R2, Durable Objects, operational telemetry",
        "approvalState": "Approved",
        "owner": "Technical / Operations owner",
        "initialReviewState": "Baseline documented; recurring supplier review pending"
      },
      "relationships": []
    },
    {
      "id": "SUP-003",
      "view": "suppliers",
      "order": 3,
      "fields": {
        "supplierService": "OpenAI Codex",
        "class": "Material AI/MCP",
        "role": "Approved external AI/MCP client/provider family connecting to WizardGang's public MCP server",
        "approvalState": "Approved",
        "owner": "AI Governance owner",
        "initialReviewState": "Approved only for existing bounded MCP interface; periodic review pending"
      },
      "relationships": []
    },
    {
      "id": "SUP-004",
      "view": "suppliers",
      "order": 4,
      "fields": {
        "supplierService": "Anthropic Claude",
        "class": "Material AI/MCP",
        "role": "Approved external AI/MCP client/provider family connecting to WizardGang's public MCP server",
        "approvalState": "Approved",
        "owner": "AI Governance owner",
        "initialReviewState": "Approved only for existing bounded MCP interface; periodic review pending"
      },
      "relationships": []
    },
    {
      "id": "SUP-005",
      "view": "suppliers",
      "order": 5,
      "fields": {
        "supplierService": "External identity provider",
        "class": "Conditional",
        "role": "OAuth/OIDC/SSO/SAML provider when a scenario is configured",
        "approvalState": "Conditional",
        "owner": "Security / Technical owner",
        "initialReviewState": "Provider-specific review required before activation"
      },
      "relationships": []
    },
    {
      "id": "SUP-006",
      "view": "suppliers",
      "order": 6,
      "fields": {
        "supplierService": "npm / open-source package ecosystem",
        "class": "Material",
        "role": "Dependency distribution and third-party application/build components",
        "approvalState": "Supporting",
        "owner": "Technical / Security owner",
        "initialReviewState": "Lockfile/audit controls exist; supplier/ecosystem review remains partial"
      },
      "relationships": []
    }
  ]
}
