{
  "schemaVersion": 1,
  "source": "governance.records",
  "qualification": "Canonical structured register facts. Human-readable views are derived from this structured state and the applicable governing procedures; no committed Markdown register is an independent authority.",
  "views": [
    {
      "id": "awareness-baseline",
      "columns": [
        {
          "key": "id",
          "label": "ID"
        },
        {
          "key": "awarenessTopic",
          "label": "Awareness topic"
        },
        {
          "key": "audience",
          "label": "Audience"
        },
        {
          "key": "requiredEvidence",
          "label": "Required evidence"
        },
        {
          "key": "targetDate",
          "label": "Target date"
        },
        {
          "key": "status",
          "label": "Status"
        }
      ]
    }
  ],
  "records": [
    {
      "id": "AW-001",
      "view": "awareness-baseline",
      "order": 1,
      "fields": {
        "awarenessTopic": "Information Security Policy and secret/public-evidence boundaries",
        "audience": "All people performing material in-scope work",
        "requiredEvidence": "Dated acknowledgement, briefing, or attributable review record",
        "targetDate": "2026-12-02",
        "status": "Planned"
      },
      "relationships": []
    },
    {
      "id": "AW-002",
      "view": "awareness-baseline",
      "order": 2,
      "fields": {
        "awarenessTopic": "AI Policy, MCP intended use, human accountability, and AI reassessment triggers",
        "audience": "AI/MCP and management roles",
        "requiredEvidence": "Dated acknowledgement/briefing and any questions/actions",
        "targetDate": "2026-12-02",
        "status": "Planned"
      },
      "relationships": []
    },
    {
      "id": "AW-003",
      "view": "awareness-baseline",
      "order": 3,
      "fields": {
        "awarenessTopic": "Codex and Claude as the only approved AI/MCP provider/client families",
        "audience": "AI/MCP, supplier, security, operations, management roles",
        "requiredEvidence": "Dated acknowledgement/briefing",
        "targetDate": "2026-12-02",
        "status": "Planned"
      },
      "relationships": []
    },
    {
      "id": "AW-004",
      "view": "awareness-baseline",
      "order": 4,
      "fields": {
        "awarenessTopic": "`DEMO-###` controlled change, release, and evidence requirements",
        "audience": "Change/release/contributor roles",
        "requiredEvidence": "Attributable review or onboarding evidence",
        "targetDate": "2026-12-02",
        "status": "Planned"
      },
      "relationships": []
    },
    {
      "id": "AW-005",
      "view": "awareness-baseline",
      "order": 5,
      "fields": {
        "awarenessTopic": "Incident, vulnerability, AI concern, and sensitive-evidence reporting routes",
        "audience": "All material roles",
        "requiredEvidence": "Exercise/briefing acknowledgement; can be combined with `EX-001`",
        "targetDate": "2026-12-02",
        "status": "Planned"
      },
      "relationships": []
    },
    {
      "id": "AW-006",
      "view": "awareness-baseline",
      "order": 6,
      "fields": {
        "awarenessTopic": "WCAG evidence expectations and no-certification/no-overclaim posture",
        "audience": "Accessibility, change, evidence, management roles",
        "requiredEvidence": "Dated review/briefing record",
        "targetDate": "2026-12-02",
        "status": "Planned"
      },
      "relationships": []
    },
    {
      "id": "AW-007",
      "view": "awareness-baseline",
      "order": 7,
      "fields": {
        "awarenessTopic": "Recovery limitations: source reconstruction is not D1/R2 restore assurance",
        "audience": "Operations, release, security, management roles",
        "requiredEvidence": "Dated review or `RT-001` exercise participation",
        "targetDate": "2026-12-02",
        "status": "Planned"
      },
      "relationships": []
    }
  ]
}
