{
  "schemaVersion": 1,
  "source": "governance.records",
  "qualification": "Canonical structured register facts. Human-readable views are derived from this structured state and the applicable governing procedures; no committed Markdown register is an independent authority.",
  "views": [
    {
      "id": "data-retention-worklist",
      "columns": [
        {
          "key": "workItem",
          "label": "Work item"
        },
        {
          "key": "affectedData",
          "label": "Affected data"
        },
        {
          "key": "expectedEvidence",
          "label": "Expected evidence"
        },
        {
          "key": "currentState",
          "label": "Current state"
        }
      ]
    }
  ],
  "records": [
    {
      "id": "DATA-RET-001",
      "view": "data-retention-worklist",
      "order": 1,
      "fields": {
        "workItem": "Define/verify expired session cleanup",
        "affectedData": "DATA-007–010",
        "expectedEvidence": "Implementation + test showing expired session and dependent records handled as designed",
        "currentState": "Planned"
      },
      "relationships": []
    },
    {
      "id": "DATA-RET-002",
      "view": "data-retention-worklist",
      "order": 2,
      "fields": {
        "workItem": "Define/verify identity/replay cleanup",
        "affectedData": "DATA-013–015",
        "expectedEvidence": "Cleanup/enforcement logic + tests across expiry/revocation/replay windows",
        "currentState": "Planned"
      },
      "relationships": []
    },
    {
      "id": "DATA-RET-003",
      "view": "data-retention-worklist",
      "order": 3,
      "fields": {
        "workItem": "Define log/telemetry pruning baseline",
        "affectedData": "DATA-003–006",
        "expectedEvidence": "Documented cadence/basis + implementation/test where automated",
        "currentState": "Planned"
      },
      "relationships": []
    },
    {
      "id": "DATA-RET-004",
      "view": "data-retention-worklist",
      "order": 4,
      "fields": {
        "workItem": "Define webhook replay/evidence retention",
        "affectedData": "DATA-011–012",
        "expectedEvidence": "Retention basis + pruning/replay tests",
        "currentState": "Planned"
      },
      "relationships": []
    },
    {
      "id": "DATA-RET-005",
      "view": "data-retention-worklist",
      "order": 5,
      "fields": {
        "workItem": "Classify R2 object sets",
        "affectedData": "DATA-016",
        "expectedEvidence": "Object-set inventory/classification + exposure/expiry/backup rules",
        "currentState": "Planned"
      },
      "relationships": []
    },
    {
      "id": "DATA-RET-006",
      "view": "data-retention-worklist",
      "order": 6,
      "fields": {
        "workItem": "Evidence D1 backup/restore",
        "affectedData": "D1 data generally",
        "expectedEvidence": "`RT-001` and actual backup/export/restore result",
        "currentState": "Planned"
      },
      "relationships": []
    },
    {
      "id": "DATA-RET-007",
      "view": "data-retention-worklist",
      "order": 7,
      "fields": {
        "workItem": "Evidence R2 backup/restore",
        "affectedData": "DATA-016",
        "expectedEvidence": "`RT-001` or successor technical restore result",
        "currentState": "Planned"
      },
      "relationships": []
    },
    {
      "id": "DATA-RET-008",
      "view": "data-retention-worklist",
      "order": 8,
      "fields": {
        "workItem": "Add MCP sensitive-field exclusion tests",
        "affectedData": "DATA-001",
        "expectedEvidence": "Automated evaluation/contract tests",
        "currentState": "Planned"
      },
      "relationships": []
    },
    {
      "id": "DATA-RET-009",
      "view": "data-retention-worklist",
      "order": 9,
      "fields": {
        "workItem": "Add provenance/freshness coverage",
        "affectedData": "DATA-001",
        "expectedEvidence": "Field/namespace documentation or metadata + evaluation",
        "currentState": "Planned"
      },
      "relationships": []
    },
    {
      "id": "DATA-RET-010",
      "view": "data-retention-worklist",
      "order": 10,
      "fields": {
        "workItem": "Test deletion from public/API/MCP views",
        "affectedData": "Applicable records",
        "expectedEvidence": "Test proving deleted/expired data is not returned through active surfaces",
        "currentState": "Planned"
      },
      "relationships": []
    }
  ]
}
