{
  "schemaVersion": 1,
  "source": "governance.records",
  "qualification": "Canonical structured register facts. Human-readable views are derived from this structured state and the applicable governing procedures; no committed Markdown register is an independent authority.",
  "views": [
    {
      "id": "access-classes",
      "columns": [
        {
          "key": "id",
          "label": "ID"
        },
        {
          "key": "accessClass",
          "label": "Access class"
        },
        {
          "key": "assetBoundary",
          "label": "Asset boundary"
        },
        {
          "key": "minimumIntendedAuthority",
          "label": "Minimum intended authority"
        },
        {
          "key": "publicRecordPosture",
          "label": "Public record posture"
        },
        {
          "key": "reviewState",
          "label": "Review state"
        }
      ]
    }
  ],
  "records": [
    {
      "id": "ACC-001",
      "view": "access-classes",
      "order": 1,
      "fields": {
        "accessClass": "Public source/site read",
        "assetBoundary": "GitHub/site/docs",
        "minimumIntendedAuthority": "Read only",
        "publicRecordPosture": "Public by design",
        "reviewState": "Met"
      },
      "relationships": []
    },
    {
      "id": "ACC-002",
      "view": "access-classes",
      "order": 2,
      "fields": {
        "accessClass": "Repository contributor/write",
        "assetBoundary": "GitHub source branches",
        "minimumIntendedAuthority": "Controlled source change",
        "publicRecordPosture": "Named account details may remain private",
        "reviewState": "Partial"
      },
      "relationships": []
    },
    {
      "id": "ACC-003",
      "view": "access-classes",
      "order": 3,
      "fields": {
        "accessClass": "Merge/release authority",
        "assetBoundary": "GitHub accepted baseline/releases",
        "minimumIntendedAuthority": "Merge/tag/release under controlled process",
        "publicRecordPosture": "Function documented",
        "reviewState": "Partial"
      },
      "relationships": []
    },
    {
      "id": "ACC-004",
      "view": "access-classes",
      "order": 4,
      "fields": {
        "accessClass": "GitHub workflow dispatch token",
        "assetBoundary": "GitHub Actions",
        "minimumIntendedAuthority": "Restricted checked-in workflow dispatch",
        "publicRecordPosture": "Secret value private; purpose public",
        "reviewState": "Partial"
      },
      "relationships": []
    },
    {
      "id": "ACC-005",
      "view": "access-classes",
      "order": 5,
      "fields": {
        "accessClass": "Git live-demo PR lifecycle token",
        "assetBoundary": "GitHub PR/status/merge/tag workflow",
        "minimumIntendedAuthority": "Controlled branch/PR/status/merge/tag tasks",
        "publicRecordPosture": "Secret value private; purpose public",
        "reviewState": "Partial"
      },
      "relationships": []
    },
    {
      "id": "ACC-006",
      "view": "access-classes",
      "order": 6,
      "fields": {
        "accessClass": "Optional GitHub read token",
        "assetBoundary": "GitHub API",
        "minimumIntendedAuthority": "Read only",
        "publicRecordPosture": "Secret value private",
        "reviewState": "Partial"
      },
      "relationships": []
    },
    {
      "id": "ACC-007",
      "view": "access-classes",
      "order": 7,
      "fields": {
        "accessClass": "Cloudflare deploy/admin access",
        "assetBoundary": "Cloudflare account/runtime",
        "minimumIntendedAuthority": "Deployment/configuration according to token/account scope",
        "publicRecordPosture": "Account details private",
        "reviewState": "Partial"
      },
      "relationships": []
    },
    {
      "id": "ACC-008",
      "view": "access-classes",
      "order": 8,
      "fields": {
        "accessClass": "Cloudflare analytics access",
        "assetBoundary": "Cloudflare analytics/billing API",
        "minimumIntendedAuthority": "Read only; Billing Read only when needed",
        "publicRecordPosture": "Account/token details private",
        "reviewState": "Partial"
      },
      "relationships": []
    },
    {
      "id": "ACC-009",
      "view": "access-classes",
      "order": 9,
      "fields": {
        "accessClass": "Application admin credential",
        "assetBoundary": "`/admin`, `/assurance` app boundary",
        "minimumIntendedAuthority": "Administrative app actions",
        "publicRecordPosture": "Credential private",
        "reviewState": "Partial"
      },
      "relationships": []
    },
    {
      "id": "ACC-010",
      "view": "access-classes",
      "order": 10,
      "fields": {
        "accessClass": "Broad operator bearer credential",
        "assetBoundary": "Application authorization boundary",
        "minimumIntendedAuthority": "None; no broad operator bearer credential is accepted by the application",
        "publicRecordPosture": "Negative security invariant; bearer writes are identity-derived and visitor-namespace bounded",
        "reviewState": "Met"
      },
      "relationships": []
    },
    {
      "id": "ACC-011",
      "view": "access-classes",
      "order": 11,
      "fields": {
        "accessClass": "Identity-derived write token",
        "assetBoundary": "visitor namespace",
        "minimumIntendedAuthority": "10-minute bounded visitor write authority",
        "publicRecordPosture": "Runtime-derived; no public token detail",
        "reviewState": "Partial"
      },
      "relationships": []
    },
    {
      "id": "ACC-012",
      "view": "access-classes",
      "order": 12,
      "fields": {
        "accessClass": "Webhook signing secrets",
        "assetBoundary": "webhook receivers",
        "minimumIntendedAuthority": "Signature verification only",
        "publicRecordPosture": "Secret private",
        "reviewState": "Partial"
      },
      "relationships": []
    },
    {
      "id": "ACC-013",
      "view": "access-classes",
      "order": 13,
      "fields": {
        "accessClass": "Session/signing secrets",
        "assetBoundary": "application/identity sessions",
        "minimumIntendedAuthority": "Session integrity/encryption",
        "publicRecordPosture": "Secret private",
        "reviewState": "Partial"
      },
      "relationships": []
    },
    {
      "id": "ACC-014",
      "view": "access-classes",
      "order": 14,
      "fields": {
        "accessClass": "Provider identity admin",
        "assetBoundary": "configured identity provider",
        "minimumIntendedAuthority": "Provider-specific admin",
        "publicRecordPosture": "Conditional until provider activation",
        "reviewState": "N/A / Conditional"
      },
      "relationships": []
    },
    {
      "id": "ACC-015",
      "view": "access-classes",
      "order": 15,
      "fields": {
        "accessClass": "Public MCP read",
        "assetBoundary": "MCP server",
        "minimumIntendedAuthority": "`demo:read`, approved read-only tools only",
        "publicRecordPosture": "Public interface",
        "reviewState": "Met"
      },
      "relationships": []
    },
    {
      "id": "ACC-016",
      "view": "access-classes",
      "order": 16,
      "fields": {
        "accessClass": "Codex MCP client",
        "assetBoundary": "MCP server",
        "minimumIntendedAuthority": "Same public MCP read boundary; no provider-specific privilege",
        "publicRecordPosture": "Approved family",
        "reviewState": "Partial"
      },
      "relationships": []
    },
    {
      "id": "ACC-017",
      "view": "access-classes",
      "order": 17,
      "fields": {
        "accessClass": "Claude MCP client",
        "assetBoundary": "MCP server",
        "minimumIntendedAuthority": "Same public MCP read boundary; no provider-specific privilege",
        "publicRecordPosture": "Approved family",
        "reviewState": "Partial"
      },
      "relationships": []
    },
    {
      "id": "ACC-018",
      "view": "access-classes",
      "order": 18,
      "fields": {
        "accessClass": "D1/R2 provider administration",
        "assetBoundary": "Cloudflare data resources",
        "minimumIntendedAuthority": "Privileged data/resource operations",
        "publicRecordPosture": "Account details private",
        "reviewState": "Partial"
      },
      "relationships": []
    },
    {
      "id": "ACC-019",
      "view": "access-classes",
      "order": 19,
      "fields": {
        "accessClass": "Management-system approval authority",
        "assetBoundary": "Governance records",
        "minimumIntendedAuthority": "Policy/scope/risk/SoA/review approvals according to roles",
        "publicRecordPosture": "Functional authority public",
        "reviewState": "Partial"
      },
      "relationships": []
    },
    {
      "id": "ACC-020",
      "view": "access-classes",
      "order": 20,
      "fields": {
        "accessClass": "Developer/admin endpoint privileged session",
        "assetBoundary": "GitHub/Cloudflare/admin",
        "minimumIntendedAuthority": "Whatever authorized privilege the operator invokes",
        "publicRecordPosture": "Device/account specifics private",
        "reviewState": "Gap"
      },
      "relationships": []
    }
  ]
}
