{
  "schemaVersion": 1,
  "source": "governance.records",
  "qualification": "Canonical structured register facts. Human-readable views are derived from this structured state and the applicable governing procedures; no committed Markdown register is an independent authority.",
  "views": [
    {
      "id": "access-reviews",
      "columns": [
        {
          "key": "id",
          "label": "ID"
        },
        {
          "key": "scope",
          "label": "Scope"
        },
        {
          "key": "state",
          "label": "State"
        },
        {
          "key": "due",
          "label": "Due"
        },
        {
          "key": "notes",
          "label": "Notes"
        }
      ]
    }
  ],
  "records": [
    {
      "id": "AR-001",
      "view": "access-reviews",
      "order": 1,
      "fields": {
        "scope": "Initial privileged/provider/source/admin access review",
        "state": "Planned",
        "due": "2026-12-02",
        "notes": "Must review GitHub, Cloudflare, app admin/API, managed credentials, data administration, governance approval authority, endpoint privilege, and current MCP/Codex/Claude authority."
      },
      "relationships": []
    }
  ]
}
